{
  "$schema": "https://json-schema.org/draft/2020-12/schema",
  "$id": "https://ninghu.github.io/agent-insights-quality/schemas/v1/email-send-request.schema.json",
  "title": "Connected Microsoft mail send request",
  "type": "object",
  "additionalProperties": false,
  "required": [
    "schema_version",
    "channel",
    "recipient",
    "subject",
    "html",
    "state",
    "retry_delays_seconds",
    "attempt_count",
    "request_hash"
  ],
  "properties": {
    "schema_version": {"const": "1.0.0"},
    "channel": {"const": "connected_microsoft_mail"},
    "recipient": {
      "type": "object",
      "additionalProperties": false,
      "required": ["mode", "address", "source"],
      "properties": {
        "mode": {"enum": ["authenticated_user", "address"]},
        "address": {"type": ["string", "null"], "format": "email"},
        "source": {"type": "string", "minLength": 1, "maxLength": 100}
      }
    },
    "subject": {"type": "string", "minLength": 1, "maxLength": 300},
    "html": {"type": "string", "minLength": 1},
    "state": {"const": "unsent"},
    "retry_delays_seconds": {
      "type": "array",
      "minItems": 1,
      "maxItems": 5,
      "items": {"type": "integer", "minimum": 1, "maximum": 3600}
    },
    "attempt_count": {"const": 0},
    "request_hash": {"type": "string", "pattern": "^sha256:[0-9a-f]{64}$"}
  }
}
