{
  "attempt_count": 0,
  "channel": "connected_microsoft_mail",
  "html": "<html><body><h1>INCONCLUSIVE</h1><h2>Summary</h2><p>Qualification stopped in runtime readiness: INCONCLUSIVE: daily runtime is not ready. Incomplete components: healthy_agents, infrastructure, live_qualification, production_orchestrator, scenario_catalog. Complete and human-review these phases before enabling daily automation.</p><p>Last confirmed stage: repository contracts loaded.</p><h2>What we are doing well</h2><p>No quality conclusion was inferred from incomplete evidence.</p><h2>Gaps and regressions</h2><p>INCONCLUSIVE: daily runtime is not ready. Incomplete components: healthy_agents, infrastructure, live_qualification, production_orchestrator, scenario_catalog. Complete and human-review these phases before enabling daily automation.</p><p>Next action: Complete and human-review every missing readiness component, then rerun the daily wrapper.</p><p>Email state: unsent. The connected mail automation may retry after 60, 300, and 900 seconds and must import a provider receipt before claiming delivery.</p><h2>Test agents and Agent Insights links</h2><table><tr><th>Agent ID</th><th>Test agent</th><th>Type</th><th>Agent Insights page</th><th>Human validation recommended</th></tr><tr><td>aiq-003-finance</td><td>aiq-003-finance</td><td>hosted_code</td><td>N/A</td><td>N/A</td></tr><tr><td>aiq-002-healthcare</td><td>aiq-002-healthcare</td><td>prompt</td><td>N/A</td><td>N/A</td></tr><tr><td>aiq-005-ticket</td><td>aiq-005-ticket</td><td>hosted_custom_container</td><td>N/A</td><td>N/A</td></tr><tr><td>aiq-004-travel</td><td>aiq-004-travel</td><td>hosted_code</td><td>N/A</td><td>N/A</td></tr><tr><td>aiq-001-weather</td><td>aiq-001-weather</td><td>prompt</td><td>N/A</td><td>N/A</td></tr></table></body></html>",
  "recipient": {
    "address": null,
    "mode": "authenticated_user",
    "source": "connected_microsoft_mailbox"
  },
  "request_hash": "sha256:a6d0694bdf7b5f0b8ae979a0b5fe2c693a619ba3c5d17ee682803b6c6488a48e",
  "retry_delays_seconds": [
    60,
    300,
    900
  ],
  "schema_version": "1.0.0",
  "state": "unsent",
  "subject": "[Agent Insights Quality] INCONCLUSIVE - 2026-08-21 - runtime readiness"
}
